{
  "schemaVersion": "temporal-overlay/v1",
  "artifactId": "overlay:drainWorkflow:trace:drained:drained-run-id",
  "staticAnalysisId": "analysis:while-loop",
  "runtimeTraceId": "trace:drained:drained-run-id",
  "workflow": "drainWorkflow",
  "staticNodes": [
    {
      "id": "workflow:drainWorkflow",
      "kind": "workflow",
      "name": "drainWorkflow",
      "observed": true,
      "source": {
        "path": "src/workflows/drain-workflow.ts",
        "pathKind": "project-relative",
        "start": {
          "line": 15,
          "column": 1,
          "offset": 552
        },
        "end": {
          "line": 26,
          "column": 2,
          "offset": 844
        },
        "symbolName": "drainWorkflow"
      }
    },
    {
      "id": "activity-call:drainWorkflow:drainOne:0",
      "kind": "activity",
      "name": "drainOne",
      "observed": true,
      "source": {
        "path": "src/workflows/drain-workflow.ts",
        "pathKind": "project-relative",
        "start": {
          "line": 20,
          "column": 11,
          "offset": 718
        },
        "end": {
          "line": 20,
          "column": 45,
          "offset": 752
        },
        "symbolName": "drainOne"
      }
    }
  ],
  "mappings": [
    {
      "runtimeOperationId": "workflow:start",
      "staticNodeId": "workflow:drainWorkflow",
      "confidence": "exact",
      "reason": "Workflow lifecycle event belongs to drainWorkflow.",
      "evidence": [
        {
          "kind": "workflow-type",
          "description": "Runtime Workflow type drainWorkflow matched static Workflow drainWorkflow.",
          "eventIds": [1],
          "staticNodeId": "workflow:drainWorkflow"
        },
        {
          "kind": "source-location",
          "description": "Static Workflow source is src/workflows/drain-workflow.ts:15.",
          "staticNodeId": "workflow:drainWorkflow"
        }
      ]
    },
    {
      "runtimeOperationId": "workflow:completed",
      "staticNodeId": "workflow:drainWorkflow",
      "confidence": "exact",
      "reason": "Workflow lifecycle event belongs to drainWorkflow.",
      "evidence": [
        {
          "kind": "workflow-type",
          "description": "Runtime Workflow type drainWorkflow matched static Workflow drainWorkflow.",
          "eventIds": [23],
          "staticNodeId": "workflow:drainWorkflow"
        },
        {
          "kind": "source-location",
          "description": "Static Workflow source is src/workflows/drain-workflow.ts:15.",
          "staticNodeId": "workflow:drainWorkflow"
        }
      ]
    },
    {
      "runtimeOperationId": "activity:drainOne:5",
      "staticNodeId": "activity-call:drainWorkflow:drainOne:0",
      "confidence": "exact",
      "reason": "Activity drainOne matched by Activity type and command order.",
      "evidence": [
        {
          "kind": "activity-type",
          "description": "Runtime Activity type drainOne matched static Activity command drainOne.",
          "eventIds": [5, 6, 7],
          "staticNodeId": "activity-call:drainWorkflow:drainOne:0"
        },
        {
          "kind": "command-order",
          "description": "Runtime Activity occurrence 1 matched static command order 0.",
          "eventIds": [5, 6, 7],
          "staticNodeId": "activity-call:drainWorkflow:drainOne:0"
        },
        {
          "kind": "source-location",
          "description": "Static Activity source is src/workflows/drain-workflow.ts:20.",
          "staticNodeId": "activity-call:drainWorkflow:drainOne:0"
        }
      ]
    },
    {
      "runtimeOperationId": "activity:drainOne:11",
      "staticNodeId": "activity-call:drainWorkflow:drainOne:0",
      "confidence": "exact",
      "reason": "Activity drainOne matched by Activity type and command order.",
      "evidence": [
        {
          "kind": "activity-type",
          "description": "Runtime Activity type drainOne matched static Activity command drainOne.",
          "eventIds": [11, 12, 13],
          "staticNodeId": "activity-call:drainWorkflow:drainOne:0"
        },
        {
          "kind": "command-order",
          "description": "Runtime Activity occurrence 2 matched static command order 0.",
          "eventIds": [11, 12, 13],
          "staticNodeId": "activity-call:drainWorkflow:drainOne:0"
        },
        {
          "kind": "source-location",
          "description": "Static Activity source is src/workflows/drain-workflow.ts:20.",
          "staticNodeId": "activity-call:drainWorkflow:drainOne:0"
        }
      ]
    },
    {
      "runtimeOperationId": "activity:drainOne:17",
      "staticNodeId": "activity-call:drainWorkflow:drainOne:0",
      "confidence": "exact",
      "reason": "Activity drainOne matched by Activity type and command order.",
      "evidence": [
        {
          "kind": "activity-type",
          "description": "Runtime Activity type drainOne matched static Activity command drainOne.",
          "eventIds": [17, 18, 19],
          "staticNodeId": "activity-call:drainWorkflow:drainOne:0"
        },
        {
          "kind": "command-order",
          "description": "Runtime Activity occurrence 3 matched static command order 0.",
          "eventIds": [17, 18, 19],
          "staticNodeId": "activity-call:drainWorkflow:drainOne:0"
        },
        {
          "kind": "source-location",
          "description": "Static Activity source is src/workflows/drain-workflow.ts:20.",
          "staticNodeId": "activity-call:drainWorkflow:drainOne:0"
        }
      ]
    }
  ],
  "branchOutcomes": [],
  "coverage": {
    "nodes": {
      "total": 2,
      "observed": 2,
      "skipped": 0,
      "unmappedRuntimeOperations": 0
    },
    "activities": {
      "staticTotal": 1,
      "observed": 1,
      "retried": 0,
      "failed": 0
    },
    "messages": {
      "staticSignals": 0,
      "receivedSignals": [],
      "staticUpdates": 0,
      "receivedUpdates": [],
      "staticQueries": 0
    },
    "timers": {
      "staticTotal": 0,
      "fired": 0,
      "canceled": 0,
      "pending": 0
    }
  },
  "diagnostics": []
}
